full_name,profile_id,user,gender,avatar_bucket_key,profile_photo_key,languages,ethnicity,user_bio,current_address,work_address,hometown,interests,preferred_commute_times
John Doe,1,john_doe_user,Male,john_doe_avatar,john_doe_photo,”English, Spanish”,Caucasian,"I'm a software engineer passionate about creating innovative solutions to complex problems. In my free time, I enjoy hiking in the great outdoors and experimenting with new recipes in the kitchen.", “123 Main St, Anytown, USA”, “456 Business Ave, Metropolis, USA,Smallville”,”Hiking, Cooking, Photography”,"8:00 AM - 9:00 AM, 5:00 PM - 6:00 PM"
Jane Smith,2,jane_smith_user,Female,jane_smith_avatar,jane_smith_photo,"English, French",African American,"As a marketing professional, I thrive on creativity and connecting with people. My love for languages and cultures fuels my passion for travel and exploration. When I'm not working, you can find me immersed in a good book or capturing moments through my camera lens.","456 Elm St, Anycity, USA","789 Corporate Blvd, Megalopolis, USA, Bigtown","Reading, Painting, Traveling","7:30 AM - 8:30 AM, 4:30 PM - 5:30 PM"
Michael Johnson,3,michael_johnson_user,Male,michael_johnson_avatar,michael_johnson_photo,"English, German",Hispanic,"I'm a music enthusiast with a knack for playing various instruments. From classical to jazz, music has always been a significant part of my life. Outside of music, I enjoy gardening and spending time outdoors with my family.","789 Oak St, Anycity, USA","1011 Industrial Pkwy, Megalopolis, USA,Midtown","Soccer, Music, Gardening","9:00 AM - 10:00 AM, 6:00 PM - 7:00 PM"
Emily Brown,4,emily_brown_user,Female,emily_brown_avatar,emily_brown_photo,English,Caucasian,"As an avid yoga practitioner and artist, I find inspiration in the balance between movement and creativity. Whether I'm flowing through poses on my mat or painting on canvas, I'm constantly exploring new ways to express myself and find inner peace.","321 Oak St, Anytown, USA,654 Office Plaza, Metropolis, USA,Downtown","Reading, Yoga, Painting","8:30 AM - 9:30 AM, 5:30 PM - 6:30 PM"
David Martinez,5,david_martinez_user,Male,david_martinez_avatar,david_martinez_photo,"English, Spanish",Hispanic,"With a passion for cooking and culinary arts, I'm always experimenting with flavors and techniques in the kitchen. When I'm not cooking up a storm, I enjoy playing soccer with friends and exploring new destinations through travel.","246 Maple St, Anycity, USA","135 Corporate Center, Megalopolis, USA,Uptown","Soccer, Cooking, Traveling","9:30 AM - 10:30 AM, 6:30 PM - 7:30 PM"
Jennifer Davis,6,jennifer_davis_user,Female,jennifer_davis_avatar,jennifer_davis_photo,"English, French",Caucasian,"As a nature lover and environmental advocate, I'm dedicated to preserving our planet for future generations. Whether it's hiking through lush forests or volunteering for conservation efforts, I'm always seeking ways to make a positive impact on the world around me.","567 Pine St, Anycity, USA","890 Business Center, Megalopolis, USA,Suburbia","Hiking, Dancing, Cooking","7:00 AM - 8:00 AM, 4:00 PM - 5:00 PM"
James Wilson,7,james_wilson_user,Male,james_wilson_avatar,james_wilson_photo,English,Caucasian,"I'm a bookworm and fishing enthusiast with a deep appreciation for the simple joys of life. Whether I'm casting a line in a tranquil lake or getting lost in the pages of a good book, I cherish moments of solitude and reflection.","789 Elm St, Anycity, USA","123 Corporate Blvd, Megalopolis, USA,Ruralville","Golfing, Fishing, Reading","8:30 AM - 9:30 AM, 5:30 PM - 6:30 PM"
Sarah Anderson,8,sarah_anderson_user,Female,sarah_anderson_avatar,sarah_anderson_photo,"English, Spanish",Caucasian,"With a love for running and photography, I'm constantly seeking adventure and capturing moments of beauty in the world around me. Whether I'm exploring new trails or experimenting with different photography techniques, I'm always eager to embrace new experiences and perspectives.","456 Maple St, Anytown, USA","789 Office Park, Metropolis, USA,Smalltown","Running, Baking, Photography","7:30 AM - 8:30 AM, 4:30 PM - 5:30 PM"
Robert Taylor,9,robert_taylor_user,Male,robert_taylor_avatar,robert_taylor_photo,English,Caucasian,"With a passion for painting and traveling, I'm always seeking inspiration from the diverse cultures and landscapes around the world. Whether I'm exploring new cities or capturing the beauty of nature on canvas, I'm constantly expanding my horizons and embracing the beauty of life's journey.","246 Oak St, Anycity, USA","579 Industrial Pkwy, Megalopolis, USA,Village","Painting, Traveling, Tennis","9:00 AM - 10:00 AM, 6:00 PM - 7:00 PM"
Olivia Martinez,10,olivia_martinez_user,Female,olivia_martinez_avatar,olivia_martinez_photo,"English, Spanish",Hispanic,"I'm a graphic designer with a passion for visual storytelling and creating captivating designs. When I'm not behind the screen, I enjoy exploring new cafes and experimenting with different cuisines in the kitchen.","123 Oak St, Anycity, USA","456 Plaza Ave, Metropolis, USA,Citytown","Designing, Cooking, Traveling","8:00 AM - 9:00 AM, 5:00 PM - 6:00 PM"
Ethan Brown,11,ethan_brown_user,Male,ethan_brown_avatar,ethan_brown_photo,English,Caucasian,"As a technology enthusiast and aspiring entrepreneur, I'm always seeking new opportunities to innovate and disrupt industries. In my free time, I enjoy playing basketball and immersing myself in the world of finance.","456 Pine St, Anytown, USA","789 Business Blvd, Megalopolis, USA,Downtown","Basketball, Investing, Coding","7:30 AM - 8:30 AM, 4:30 PM - 5:30 PM"
Isabella Nguyen,12,isabella_nguyen_user,Female,isabella_nguyen_avatar,isabella_nguyen_photo,"English, Vietnamese",Asian,"With a background in environmental science, I'm passionate about sustainability and conservation. Whether I'm hiking in the mountains or volunteering at local wildlife sanctuaries, I'm committed to protecting our planet for future generations.","789 Elm St, Anycity, USA","1011 Industrial Pkwy, Megalopolis, USA,Uptown","Hiking, Volunteering, Photography","9:00 AM - 10:00 AM, 6:00 PM - 7:00 PM"
William Garcia,13,william_garcia_user,Male,william_garcia_avatar,william_garcia_photo,"English, Spanish",Hispanic,"I'm a fitness enthusiast and personal trainer dedicated to helping others achieve their health and wellness goals. When I'm not in the gym, you can find me exploring new hiking trails or experimenting with healthy recipes in the kitchen.","246 Maple St, Anycity, USA","135 Corporate Center, Megalopolis, USA,Uptown","Fitness, Cooking, Traveling","9:30 AM - 10:30 AM, 6:30 PM - 7:30 PM"
Sophia Robinson,14,sophia_robinson_user,Female,sophia_robinson_avatar,sophia_robinson_photo,English,Caucasian,"As a freelance writer and avid reader, I'm constantly seeking inspiration and storytelling opportunities. Whether I'm penning articles or escaping into the pages of a novel, I'm always immersed in the world of words.","567 Oak St, Anycity, USA","890 Business Center, Megalopolis, USA,Suburbia","Writing, Reading, Traveling","8:30 AM - 9:30 AM, 5:30 PM - 6:30 PM"
Alexander Kim,15,alexander_kim_user,Male,alexander_kim_avatar,alexander_kim_photo,"English, Korean",Asian,"With a passion for technology and innovation, I'm always exploring new advancements and tinkering with gadgets. When I'm not coding or troubleshooting, I enjoy playing soccer and exploring the latest trends in fashion.","789 Elm St, Anycity, USA","123 Corporate Blvd, Megalopolis, USA,Uptown","Soccer, Coding, Fashion","7:30 AM - 8:30 AM, 4:30 PM - 5:30 PM"
Mia Lewis,16,mia_lewis_user,Female,mia_lewis_avatar,mia_lewis_photo,English,Caucasian,"As a nature enthusiast and animal lover, I'm always seeking outdoor adventures and wildlife encounters. Whether I'm camping under the stars or volunteering at local animal shelters, I'm happiest when surrounded by nature.","456 Maple St, Anytown, USA","789 Office Park, Metropolis, USA,Smalltown","Hiking, Volunteering, Photography","9:00 AM - 10:00 AM, 6:00 PM - 7:00 PM"
Michael Smith,17,michael_smith_user,Male,michael_smith_avatar,michael_smith_photo,"English, Spanish",Caucasian,"I'm a travel blogger and adventure seeker on a mission to explore the world's hidden gems. Whether I'm trekking through remote landscapes or sampling local cuisines, I'm always seeking unforgettable experiences to share with my audience.","246 Oak St, Anycity, USA","135 Corporate Center, Megalopolis, USA,Uptown","Traveling, Blogging, Photography","9:30 AM - 10:30 AM, 6:30 PM - 7:30 PM"
Charlotte Patel,18,charlotte_patel_user,Female,charlotte_patel_avatar,charlotte_patel_photo,"English, Hindi",Asian,"With a background in psychology and a passion for mental health advocacy, I'm dedicated to breaking the stigma surrounding mental illness and promoting emotional well-being. Whether I'm leading support groups or practicing mindfulness, I'm committed to fostering a supportive community for those in need.","789 Oak St, Anycity, USA","1011 Industrial Pkwy, Megalopolis, USA,Midtown","Advocacy, Mindfulness, Reading","8:00 AM - 9:00 AM, 5:00 PM - 6:00 PM"
Noah Johnson,19,noah_johnson_user,Male,noah_johnson_avatar,noah_johnson_photo,English,Caucasian,"With a background in environmental science, I'm passionate about sustainability and conservation. Whether I'm hiking in the mountains or volunteering at local wildlife sanctuaries, I'm committed to protecting our planet for future generations.","456 Elm St, Anycity, USA","789 Corporate Blvd, Megalopolis, USA,Bigtown","Hiking, Volunteering, Photography","7:30 AM - 8:30 AM, 4:30 PM - 5:30 PM"
Emma Lee,20,emma_lee_user,Female,emma_lee_avatar,emma_lee_photo,"English, Mandarin",Asian,"As a language enthusiast and world traveler, I'm constantly seeking opportunities to learn and immerse myself in new cultures. Whether I'm studying a new language or exploring a new country, I'm always eager to expand my horizons and connect with people from diverse backgrounds.","789 Oak St, Anycity, USA","1011 Industrial Pkwy, Megalopolis, USA,Midtown","Language learning, Traveling", Photography,"9:00 AM - 10:00 AM, 6:00 PM - 7:00 PM"
Aiden Thompson,21,aiden_thompson_user,Male,aiden_thompson_avatar,aiden_thompson_photo,English,Caucasian,"I'm a fitness enthusiast and personal trainer dedicated to helping others achieve their health and wellness goals. When I'm not in the gym, you can find me exploring new hiking trails or experimenting with healthy recipes in the kitchen.","246 Maple St, Anycity, USA","135 Corporate Center, Megalopolis, USA,Uptown","Fitness, Cooking, Traveling","9:30 AM - 10:30 AM, 6:30 PM - 7:30 PM"
Sophie Nguyen,22,sophie_nguyen_user,Female,sophie_nguyen_avatar,sophie_nguyen_photo,"English, Vietnamese",Asian,"With a passion for art and design, I'm constantly seeking inspiration from the world around me. Whether I'm sketching in my notebook or exploring galleries in the city, I'm always eager to express my creativity and share my vision with others.","567 Pine St, Anycity, USA","890 Business Center, Megalopolis, USA,Suburbia","Art, Design, Traveling","7:00 AM - 8:00 AM, 4:00 PM - 5:00 PM"
Jacob Kim,23,jacob_kim_user,Male,jacob_kim_avatar,jacob_kim_photo,"English, Korean",Asian,"As a technology enthusiast and software developer, I'm passionate about creating innovative solutions to real-world problems. Whether I'm coding a new app or exploring the latest developments in AI, I'm always eager to push the boundaries of what's possible with technology.","789 Elm St, Anycity, USA","123 Corporate Blvd, Megalopolis, USA,Uptown","Programming, Gaming, Traveling","7:30 AM - 8:30 AM, 4:30 PM - 5:30 PM"
Ella Baker,24,ella_baker_user,Female,ella_baker_avatar,ella_baker_photo,English,Caucasian,"With a background in education and a passion for lifelong learning, I'm dedicated to empowering others through knowledge and personal growth. Whether I'm teaching in the classroom or pursuing my own interests, I'm always eager to inspire curiosity and foster a love of learning.","456 Maple St, Anytown, USA","789 Office Park, Metropolis, USA,Smalltown","Reading, Teaching, Traveling","7:30 AM - 8:30 AM, 4:30 PM - 5:30 PM"
Daniel Garcia,25,daniel_garcia_user,Male,daniel_garcia_avatar,daniel_garcia_photo,"English, Spanish",Hispanic,"With a love for adventure and a curiosity about the world, I'm always seeking new experiences and pushing my limits. Whether I'm exploring remote wilderness areas or trying exotic foods, I'm happiest when I'm on the move and discovering something new.","246 Oak St, Anycity, USA","135 Corporate Center, Megalopolis, USA,Uptown","Traveling, Hiking, Food tasting","9:30 AM - 10:30 AM, 6:30 PM - 7:30 PM"
Grace Chen,26,grace_chen_user,Female,grace_chen_avatar,grace_chen_photo,"English, Mandarin",Asian,"As a digital nomad and freelance writer, I'm constantly on the move and exploring new destinations. Whether I'm working from a beachside cafe or hiking in the mountains, I'm always inspired by the beauty of the world around me and the stories waiting to be told.","789 Oak St, Anycity, USA","1011 Industrial Pkwy, Megalopolis, USA,Midtown","Writing, Traveling, Photography","8:00 AM - 9:00 AM, 5:00 PM - 6:00 PM"
Oliver Patel,27,oliver_patel_user,Male,oliver_patel_avatar,oliver_patel_photo,"English, Hindi",Asian,"With a background in finance and a passion for investing, I'm dedicated to helping others achieve financial freedom and security. Whether I'm analyzing market trends or mentoring aspiring investors, I'm always eager to share my knowledge and expertise.","456 Elm St, Anycity, USA","789 Corporate Blvd, Megalopolis, USA,Bigtown","Investing, Mentoring, Reading","7:30 AM - 8:30 AM, 4:30 PM - 5:30 PM"
Liam Wilson,28,liam_wilson_user,Male,liam_wilson_avatar,liam_wilson_photo,English,Caucasian,"As an outdoor enthusiast and nature lover, I'm always seeking new adventures in the wilderness. Whether I'm hiking in the mountains or camping under the stars, I find solace and inspiration in the beauty of the natural world.","246 Maple St, Anycity, USA","135 Corporate Center, Megalopolis, USA,Uptown","Hiking, Camping, Photography","9:30 AM - 10:30 AM, 6:30 PM - 7:30 PM"
Ava Martinez,29,ava_martinez_user,Female,ava_martinez_avatar,ava_martinez_photo,English, Spanish,Hispanic,"With a passion for music and a talent for singing, I'm always seeking opportunities to share my voice and connect with others. Whether I'm performing on stage or jamming with friends, music is my greatest passion and source of joy.","567 Pine St, Anycity, USA","890 Business Center, Megalopolis, USA,Suburbia","Singing, Dancing, Traveling","7:00 AM - 8:00 AM, 4:00 PM - 5:00 PM"
Logan White,30,logan_white_user,Male,logan_white_avatar,logan_white_photo,English,Caucasian,"As a thrill-seeker and adrenaline junkie, I'm always on the lookout for the next exciting adventure. Whether I'm skydiving from 10,000 feet or shredding down mountain slopes, I live for the rush of adrenaline and the thrill of pushing my limits.","789 Elm St, Anycity, USA","123 Corporate Blvd, Megalopolis, USA,Uptown","Extreme sports, Traveling, Photography","7:30 AM - 8:30 AM, 4:30 PM - 5:30 PM"
Chloe Kim,31,chloe_kim_user,Female,chloe_kim_avatar,chloe_kim_photo,"English, Korean",Asian,"With a passion for fashion and a keen eye for style, I'm constantly experimenting with new looks and trends. Whether I'm designing my own clothes or curating outfits for social media, fashion is my creative outlet and form of self-expression.","456 Maple St, Anytown, USA","789 Office Park, Metropolis, USA,Smalltown",Fashion design, Styling, Traveling,"9:00 AM - 10:00 AM, 6:00 PM - 7:00 PM"
Mason Rodriguez,32,mason_rodriguez_user,Male,mason_rodriguez_avatar,mason_rodriguez_photo,English, Spanish,Hispanic,"As a foodie and culinary enthusiast, I'm always on the hunt for the next delicious meal. Whether I'm exploring local eateries or experimenting with new recipes at home, food is my passion and source of inspiration.","246 Oak St, Anycity, USA","135 Corporate Center, Megalopolis, USA,Uptown","Food tasting, Cooking, Traveling","9:30 AM - 10:30 AM, 6:30 PM - 7:30 PM"
Evelyn Carter,33,evelyn_carter_user,Female,evelyn_carter_avatar,evelyn_carter_photo,English,Caucasian,"With a love for literature and a passion for storytelling, I'm always immersed in the world of books and imagination. Whether I'm writing my own stories or exploring new literary works, literature is my escape and my sanctuary.","789 Oak St, Anycity, USA","1011 Industrial Pkwy, Megalopolis, USA,Midtown","Reading, Writing, Traveling","8:00 AM - 9:00 AM, 5:00 PM - 6:00 PM"
Lucas Nguyen,34,lucas_nguyen_user,Male,lucas_nguyen_avatar,lucas_nguyen_photo,"English, Vietnamese",Asian,"As a technology enthusiast and software developer, I'm passionate about creating innovative solutions to real-world problems. Whether I'm coding a new app or building websites for clients, technology is my medium for making a positive impact on the world.","456 Elm St, Anycity, USA","789 Corporate Blvd, Megalopolis, USA,Bigtown","Programming, Web development, Gaming","7:30 AM - 8:30 AM, 4:30 PM - 5:30 PM"
Lily Patel,35,lily_patel_user,Female,lily_patel_avatar,lily_patel_photo,"English, Hindi",Asian,"With a background in environmental science and a love for the outdoors, I'm dedicated to protecting our planet and preserving its natural beauty. Whether I'm hiking in the mountains or volunteering for environmental causes, I'm committed to making a positive impact on the world around me.","567 Pine St, Anycity, USA","890 Business Center, Megalopolis, USA,Suburbia","Hiking, Volunteering, Photography","7:00 AM - 8:00 AM
Henry Lee,36,henry_lee_user,Male,henry_lee_avatar,henry_lee_photo,"English, Mandarin",Asian,"As a travel photographer and storyteller, I'm always on the lookout for the next great adventure. Whether I'm capturing stunning landscapes or documenting vibrant cultures, photography is my way of sharing the beauty of the world with others.","789 Elm St, Anycity, USA","123 Corporate Blvd, Megalopolis, USA,Uptown","Photography, Traveling, Writing","7:30 AM - 8:30 AM, 4:30 PM - 5:30 PM"
"Emma Thompson","37","emma_thompson_user","Female","emma_thompson_avatar","emma_thompson_photo","English","Caucasian","As a fitness coach and wellness advocate, I'm passionate about helping others lead healthier and more fulfilling lives. Whether I'm leading group fitness classes or providing personalized coaching sessions, I'm dedicated to empowering my clients to reach their full potential.","246 Maple St, Anycity, USA","135 Corporate Center, Megalopolis, USA,Uptown","Fitness, Coaching, Traveling","9:30 AM - 10:30 AM, 6:30 PM - 7:30 PM"
"Jackson Brown","38","jackson_brown_user","Male","jackson_brown_avatar","jackson_brown_photo","English","Caucasian","With a love for the great outdoors and a passion for adventure, I'm always seeking new experiences and challenges. Whether I'm hiking in the mountains or kayaking down a river, nature is my playground and my sanctuary.","789 Elm St, Anycity, USA","123 Corporate Blvd, Megalopolis, USA,Uptown","Hiking, Kayaking, Photography","7:30 AM - 8:30 AM, 4:30 PM - 5:30 PM"
"Olivia Garcia","39","olivia_garcia_user","Female","olivia_garcia_avatar","olivia_garcia_photo","English, Spanish","Hispanic","With a background in environmental science and a passion for sustainability, I'm dedicated to making a positive impact on the planet. Whether I'm leading beach cleanups or advocating for renewable energy, I'm committed to creating a greener and more sustainable future.","567 Pine St, Anycity, USA","890 Business Center, Megalopolis, USA,Suburbia","Hiking, Volunteering, Photography","7:00 AM - 8:00 AM, 4:00 PM - 5:00 PM"
"William White","40","william_white_user","Male","william_white_avatar","william_white_photo","English","Caucasian","As a technology enthusiast and software engineer, I'm passionate about building innovative solutions to complex problems. Whether I'm coding algorithms or developing user interfaces, I'm always seeking to push the boundaries of what's possible with technology.","456 Elm St, Anycity, USA","789 Corporate Blvd, Megalopolis, USA,Bigtown","Programming, Web development, Gaming","7:30 AM - 8:30 AM, 4:30 PM - 5:30 PM"
"Sophia Johnson","41","sophia_johnson_user","Female","sophia_johnson_avatar","sophia_johnson_photo","English","Caucasian","As a digital marketer and social media strategist, I'm constantly exploring new trends and strategies to help businesses succeed online. Whether I'm creating engaging content or analyzing data analytics, I'm always focused on driving results and exceeding expectations.","789 Oak St, Anycity, USA","1011 Industrial Pkwy, Megalopolis, USA,Midtown","Marketing, Social media, Traveling","8:00 AM - 9:00 AM, 5:00 PM - 6:00 PM"
"Daniel Wilson","42","daniel_wilson_user","Male","daniel_wilson_avatar","daniel_wilson_photo","English","Caucasian","With a passion for art and design, I'm constantly exploring new ways to express my creativity and share my vision with the world. Whether I'm painting on canvas or designing digital illustrations, art is my medium for self-expression and storytelling.","246 Maple St, Anycity, USA","135 Corporate Center, Megalopolis, USA,Uptown","Art, Design, Traveling","9:30 AM - 10:30 AM, 6:30 PM - 7:30 PM"
"Charlotte Smith","43","charlotte_smith_user","Female","charlotte_smith_avatar","charlotte_smith_photo","English","Caucasian","As a freelance writer and editor, I'm passionate about storytelling and crafting compelling narratives. Whether I'm writing articles for publications or editing manuscripts for authors, I'm always striving to create impactful content that resonates with audiences.","567 Pine St, Anycity, USA","890 Business Center, Megalopolis, USA,Suburbia","Writing, Editing, Traveling","7:00 AM - 8:00 AM, 4:00 PM - 5:00 PM"
"Michael Brown","44","michael_brown_user","Male","michael_brown_avatar","michael_brown_photo","English","Caucasian","With a love for music and a talent for playing instruments, I'm constantly exploring new genres and honing my skills. Whether I'm jamming with friends or performing on stage, music is my passion and my way of connecting with others.","789 Elm St, Anycity, USA","123 Corporate Blvd, Megalopolis, USA,Uptown","Music, Playing instruments, Traveling","7:30 AM - 8:30 AM, 4:30 PM - 5:30 PM"
"Amelia Martinez","45","amelia_martinez_user","Female","amelia_martinez_avatar","amelia_martinez_photo","English, Spanish","Hispanic","As a yoga instructor and mindfulness coach, I'm dedicated to helping others find peace and balance in their lives. Whether I'm leading yoga classes or hosting meditation workshops, I'm committed to empowering my students to cultivate a sense of calm and well-being.","456 Elm St, Anycity, USA","789 Corporate Blvd, Megalopolis, USA,Bigtown","Yoga, Meditation, Traveling","7:30 AM - 8:30 AM, 4:30 PM - 5:30 PM"
"Alexander Brown","46","alexander_brown_user","Male","alexander_brown_avatar","alexander_brown_photo","English","Caucasian","As a software developer and technology enthusiast, I'm passionate about building innovative solutions to complex problems. Whether I'm coding algorithms or developing new software applications, I'm always seeking to push the boundaries of what's possible with technology.","789 Oak St, Anycity, USA","1011 Industrial Pkwy, Megalopolis, USA,Midtown","Programming, Web development, Gaming","8:00 AM - 9:00 AM, 5:00 PM - 6:00 PM"
"Emma Garcia","47","emma_garcia_user","Female","emma_garcia_avatar","emma_garcia_photo","English, Spanish","Hispanic","As a yoga instructor and mindfulness coach, I'm dedicated to helping others find peace and balance in their lives. Whether I'm leading yoga classes or hosting meditation workshops, I'm committed to empowering my students to cultivate a sense of calm and well-being.","456 Elm St, Anycity, USA","789 Corporate Blvd, Megalopolis, USA,Bigtown","Yoga, Meditation, Traveling","7:30 AM - 8:30 AM, 4:30 PM - 5:30 PM"
"Grace Taylor","48","grace_taylor_user","Female","grace_taylor_avatar","grace_taylor_photo","English","Caucasian","With a passion for literature and a love for storytelling, I'm constantly immersed in the world of books and imagination. Whether I'm writing my own stories or exploring new literary works, literature is my escape and my sanctuary.","789 Oak St, Anycity, USA","1011 Industrial Pkwy, Megalopolis, USA,Midtown","Reading, Writing, Traveling","8:00 AM - 9:00 AM, 5:00 PM - 6:00 PM"
"Nathan Baker","49","nathan_baker_user","Male","nathan_baker_avatar","nathan_baker_photo","English","Caucasian","As a software engineer and technology enthusiast, I'm passionate about creating innovative solutions to complex problems. Whether I'm coding algorithms or developing new software applications, I'm always eager to push the boundaries of what's possible with technology.","456 Elm St, Anycity, USA","789 Corporate Blvd, Megalopolis, USA,Bigtown","Programming, Web development, Gaming","7:30 AM - 8:30 AM, 4:30 PM - 5:30 PM"
"Ava Hernandez","50","ava_hernandez_user","Female","ava_hernandez_avatar","ava_hernandez_photo","English, Spanish","Hispanic","With a background in finance and a passion for investing, I'm dedicated to helping others achieve financial freedom and security. Whether I'm analyzing market trends or mentoring aspiring investors, I'm always eager to share my knowledge and expertise.","789 Elm St, Anycity, USA","123 Corporate Blvd, Megalopolis, USA,Uptown","Investing, Mentoring, Reading","7:30 AM - 8:30 AM, 4:30 PM - 5:30 PM"
"Oliver Smith","51","oliver_smith_user","Male","oliver_smith_avatar","oliver_smith_photo","English","Caucasian","As a digital marketer and social media strategist, I'm constantly exploring new trends and strategies to help businesses succeed online. Whether I'm creating engaging content or analyzing data analytics, I'm always focused on driving results and exceeding expectations.","456 Elm St, Anycity, USA","789 Corporate Blvd, Megalopolis, USA,Bigtown","Marketing, Social media, Traveling","8:00 AM - 9:00 AM, 5:00 PM - 6:00 PM"
