full_name,profile_id,user,gender,avatar_bucket_key,profile_photo_key,languages,ethnicity,user_bio,current_address,work_address,hometown,interests,preferred_commute_times
"Isabella Nguyen","52","isabella_nguyen_user","Female","isabella_nguyen_avatar","isabella_nguyen_photo","English, Vietnamese","Asian","With a love for art and a passion for design, I'm constantly seeking inspiration from the world around me. Whether I'm sketching in my notebook or exploring galleries in the city, I'm always eager to express my creativity and share my vision with others.","789 Oak St, Anycity, USA","1011 Industrial Pkwy, Megalopolis, USA,Midtown","Art, Design, Traveling","8:00 AM - 9:00 AM, 5:00 PM - 6:00 PM"
"Ethan Rodriguez","53","ethan_rodriguez_user","Male","ethan_rodriguez_avatar","ethan_rodriguez_photo","English, Spanish","Hispanic","As a fitness enthusiast and personal trainer, I'm dedicated to helping others achieve their health and wellness goals. Whether I'm in the gym or exploring new hiking trails, I'm committed to inspiring and motivating my clients to reach their full potential.","456 Elm St, Anycity, USA","789 Corporate Blvd, Megalopolis, USA,Bigtown","Fitness, Hiking, Traveling","7:30 AM - 8:30 AM, 4:30 PM - 5:30 PM"
"Sophie Baker","54","sophie_baker_user","Female","sophie_baker_avatar","sophie_baker_photo","English","Caucasian","With a passion for travel and a love for adventure, I'm always seeking new experiences and challenges. Whether I'm exploring remote wilderness areas or immersing myself in different cultures, I'm happiest when I'm on the move and discovering something new.","789 Elm St, Anycity, USA","123 Corporate Blvd, Megalopolis, USA,Uptown","Traveling, Hiking, Photography","7:30 AM - 8:30 AM, 4:30 PM - 5:30 PM"
"Liam Thompson","55","liam_thompson_user","Male","liam_thompson_avatar","liam_thompson_photo","English","Caucasian","With a love for music and a talent for playing instruments, I'm constantly exploring new genres and honing my skills. Whether I'm jamming with friends or performing on stage, music is my passion and my way of connecting with others.","456 Elm St, Anycity, USA","789 Corporate Blvd, Megalopolis, USA,Bigtown","Music, Playing instruments, Traveling","7:30 AM - 8:30 AM, 4:30 PM - 5:30 PM"
"Aria Martinez","56","aria_martinez_user","Female","aria_martinez_avatar","aria_martinez_photo","English, Spanish","Hispanic","As a food enthusiast and culinary explorer, I'm always on the lookout for the next delicious meal. Whether I'm dining at a Michelin-starred restaurant or trying street food in a foreign city, I'm passionate about experiencing the diverse flavors of the world.","789 Oak St, Anycity, USA","1011 Industrial Pkwy, Megalopolis, USA,Midtown","Food tasting, Cooking, Traveling","8:00 AM - 9:00 AM, 5:00 PM - 6:00 PM"
"Owen Wilson","57","owen_wilson_user","Male","owen_wilson_avatar","owen_wilson_photo","English","Caucasian","With a background in education and a passion for teaching, I'm dedicated to inspiring the next generation of learners. Whether I'm in the classroom or exploring new teaching methods, I'm committed to fostering a love of learning and helping students realize their potential.","456 Elm St, Anycity, USA","789 Corporate Blvd, Megalopolis, USA,Bigtown","Teaching, Education, Traveling","7:30 AM - 8:30 AM, 4:30 PM - 5:30 PM"
"Scarlett Lee","58","scarlett_lee_user","Female","scarlett_lee_avatar","scarlett_lee_photo","English","Caucasian","As a fashion designer and trendsetter, I'm constantly pushing the boundaries of style and creativity. Whether I'm designing runway collections or curating looks for social media, fashion is my passion and my way of expressing myself.","789 Elm St, Anycity, USA","123 Corporate Blvd, Megalopolis, USA,Uptown","Fashion design, Styling, Traveling","7:30 AM - 8:30 AM, 4:30 PM - 5:30 PM"
"Lucas Martin","59","lucas_martin_user","Male","lucas_martin_avatar","lucas_martin_photo","English","Caucasian","As a technology enthusiast and software developer, I'm passionate about creating innovative solutions to real-world problems. Whether I'm coding a new app or building websites for clients, technology is my medium for making a positive impact on the world.","456 Elm St, Anycity, USA","789 Corporate Blvd, Megalopolis, USA,Bigtown","Programming, Web development, Gaming","7:30 AM - 8:30 AM, 4:30 PM - 5:30 PM"
"Sofia Hernandez","60","sofia_hernandez_user","Female","sofia_hernandez_avatar","sofia_hernandez_photo","English, Spanish","Hispanic","With a passion for photography and a love for storytelling, I'm always seeking to capture the beauty of the world around me. Whether I'm documenting everyday moments or exploring exotic locations, photography is my way of preserving memories and sharing stories.","789 Oak St, Anycity, USA","1011 Industrial Pkwy, Megalopolis, USA,Midtown","Photography, Traveling, Writing","8:00 AM - 9:00 AM, 5:00 PM - 6:00 PM"
